url,img,lines,author
https://www.passiton.com/inspirational-quotes/8022-the-essence-of-life-is-not-in-the-great,https://www.passiton.com/quotes/images/8022/large_20251226_friday_quote.jpg,"The essence of life is not in the great victories and grand failures, but in the simple joys. #<Author:0x00007fcdfaf67320>",
https://www.passiton.com/inspirational-quotes/8407-the-joy-of-giving-is-the-greatest-joy-of-life,https://www.passiton.com/quotes/images/8407/large_20251225_thursday_quote.jpg,The joy of giving is the greatest joy of life. #<Author:0x00007fcdfaf66ba0>,
https://www.passiton.com/inspirational-quotes/7571-happiness-not-in-another-place-but-this,https://www.passiton.com/quotes/images/7571/large_20251224_wednesday_quote.jpg,"Happiness—not in another place, but this place... not for another hour, but for this hour. #<Author:0x00007fcdfaf66420>",
https://www.passiton.com/inspirational-quotes/7844-joy-is-the-kind-of-happiness-that-doesn-t,https://www.passiton.com/quotes/images/7844/large_20251223_tuesday_quote.jpg,Joy is the kind of happiness that doesn’t depend on what happens. #<Author:0x00007fcdfaf65de0>,
https://www.passiton.com/inspirational-quotes/8322-if-you-carry-joy-in-your-heart-you-can-heal,https://www.passiton.com/quotes/images/8322/large_20251222_monday_quote.jpg,"If you carry joy in your heart, you can heal any moment. #<Author:0x00007fcdfaf65520>",
https://www.passiton.com/inspirational-quotes/6067-dont-worry-when-you-are-not-recognized-but,https://www.passiton.com/quotes/images/6067/large_20261219_friday_quote.jpg,"Don't worry when you are not recognized, but strive to be worthy of recognition.  #<Author:0x00007fcdfaf625a0>",
https://www.passiton.com/inspirational-quotes/7190-i-have-not-failed-ive-just-found-10-000-ways,https://www.passiton.com/quotes/images/7190/large_20261218_thursday_quote.jpg,"I have not failed. I've just found 10,000 ways that won't work. #<Author:0x00007fcdfaf617e0>",
https://www.passiton.com/inspirational-quotes/5819-when-you-start-to-develop-your-powers-of,https://www.passiton.com/quotes/images/5819/large_20261217_wednesday_quote.jpg,"When you start to develop your powers of empathy and imagination, the whole world opens up to you. #<Author:0x00007fcdfaf611a0>",
https://www.passiton.com/inspirational-quotes/6638-the-only-person-you-are-destined-to-become-is,https://www.passiton.com/quotes/images/6638/large_20261216_tuesday_quote.jpg,The only person you are destined to become is the person you decide to be. #<Author:0x00007fcdfaf60660>,
https://www.passiton.com/inspirational-quotes/8296-when-we-strive-to-become-better-than-we-are,https://www.passiton.com/quotes/images/8296/large_20261215_monday_quote.jpg,"When we strive to become better than we are, everything around us becomes better, too. #<Author:0x00007fcdfaf712d0>",
https://www.passiton.com/inspirational-quotes/8466-practice-like-you-ve-never-won-play-like,https://www.passiton.com/quotes/images/8466/large_20251212_friday_quote.jpg,Practice like you’ve never won. Play like you’ve never lost. #<Author:0x00007fcdfaf70c90>,
https://www.passiton.com/inspirational-quotes/6797-practice-is-the-best-of-all-instructors,https://www.passiton.com/quotes/images/6797/large_20251211_thursday_quote.jpg,Practice is the best of all instructors. #<Author:0x00007fcdfaf7fa10>,
https://www.passiton.com/inspirational-quotes/8465-talent-is-a-pursued-interest-anything-that,https://www.passiton.com/quotes/images/8465/large_20251210_wednesday_quote.jpg,"Talent is a pursued interest. Anything that you’re willing to practice, you can do. #<Author:0x00007fcdfaf7e9d0>",
https://www.passiton.com/inspirational-quotes/8464-the-difference-between-ordinary-and,https://www.passiton.com/quotes/images/8464/large_20251209_tuesday_quote.jpg,The difference between ordinary and extraordinary is practice. #<Author:0x00007fcdfaf7dc10>,
https://www.passiton.com/inspirational-quotes/8463-practice-creates-confidence-confidence,https://www.passiton.com/quotes/images/8463/large_20251208_monday_quote.jpg,Practice creates confidence. Confidence empowers you. #<Author:0x00007fcdfaf7cbd0>,
https://www.passiton.com/inspirational-quotes/7159-no-one-has-ever-become-poor-by-giving,https://www.passiton.com/quotes/images/7159/large_20251205_friday_quote.jpg,No one has ever become poor by giving. #<Author:0x00007fcdfaf7c310>,
https://www.passiton.com/inspirational-quotes/8462-the-more-generous-we-are-the-more-joyous-we,https://www.passiton.com/quotes/images/8462/large_20251204_thursday_quote.jpg,"The more generous we are, the more joyous we become. #<Author:0x00007fcdfaf7b190>",
https://www.passiton.com/inspirational-quotes/8461-sometimes-when-we-are-generous-in-small-barely,https://www.passiton.com/quotes/images/8461/large_20251203_wednesday_quote.jpg,"Sometimes when we are generous in small, barely detectable ways it can change someone else's life forever. #<Author:0x00007fcdfaf79750>",
https://www.passiton.com/inspirational-quotes/8460-the-greatest-gift-you-ever-give-is-your-honest,https://www.passiton.com/quotes/images/8460/large_20251202_tuesday_quote.jpg,The greatest gift you ever give is your honest self. #<Author:0x00007fcdfaf78490>,
https://www.passiton.com/inspirational-quotes/5210-good-actions-give-strength-to-ourselves-and,https://www.passiton.com/quotes/images/5210/large_20251201_monday_quote.jpg,Good actions give strength to ourselves and inspire good actions in others. #<Author:0x00007fcdfaf77090>,
https://www.passiton.com/inspirational-quotes/8367-the-more-grateful-i-am-the-more-beauty-i-see,https://www.passiton.com/quotes/images/8367/large_20251128_friday_quote.jpg,"The more grateful I am, the more beauty I see. #<Author:0x00007fcdfaf762d0>",
https://www.passiton.com/inspirational-quotes/7426-as-we-express-our-gratitude-we-must-never,https://www.passiton.com/quotes/images/7426/large_20251127_thursday_quote.jpg,"As we express our gratitude, we must never forget that the highest appreciation is not to utter words, but to live by them. #<Author:0x00007fcdfaf75650>",
https://www.passiton.com/inspirational-quotes/8400-showing-gratitude-is-one-of-the-simplest-yet,https://www.passiton.com/quotes/images/8400/large_20251126_wednesday_quote.jpg,Showing gratitude is one of the simplest yet most powerful things humans can do for each other. #<Author:0x00007fcdfaf74b10>,
https://www.passiton.com/inspirational-quotes/8157-start-each-day-with-a-positive-thought-and-a,https://www.passiton.com/quotes/images/8157/large_20251125_tuesday_quote.jpg,Start each day with a positive thought and a grateful heart. #<Author:0x00007fcdfaf744d0>,
https://www.passiton.com/inspirational-quotes/8160-gratitude-unlocks-the-fullness-of-life-it,https://www.passiton.com/quotes/images/8160/large_20251124_monday_quote.jpg,"Gratitude unlocks the fullness of life. It turns what we have into enough, and more. #<Author:0x00007fcdfaf73d50>",
https://www.passiton.com/inspirational-quotes/3983-yesterday-is-history-tomorrow-is-a-mystery,https://www.passiton.com/quotes/images/3983/large_20251121_friday_quote.jpg,Yesterday is history. Tomorrow is a mystery. Today is a gift. #<Author:0x00007fcdfaf73850>,
https://www.passiton.com/inspirational-quotes/6639-sometimes-you-will-never-know-the-value-of-a,https://www.passiton.com/quotes/images/6639/large_20251120_thursday_quote.jpg,Sometimes you will never know the value of a moment until it becomes a memory. #<Author:0x00007fcdfaf72f90>,
https://www.passiton.com/inspirational-quotes/3072-the-best-way-to-pay-for-a-lovely-moment-is-to,https://www.passiton.com/quotes/images/3072/large_20251119_wednesday_quote.jpg,The best way to pay for a lovely moment is to enjoy it. #<Author:0x00007fcdfaf726d0>,
https://www.passiton.com/inspirational-quotes/4298-appreciation-is-a-wonderful-thing-it-makes,https://www.passiton.com/quotes/images/4298/large_20251118_tuesday_quote.jpg,Appreciation is a wonderful thing. It makes what is excellent in others belong to us as well. #<Author:0x00007fcdfaf71b90>,
https://www.passiton.com/inspirational-quotes/6794-what-counts-can-t-always-be-counted-what-can,https://www.passiton.com/quotes/images/6794/large_20251117_monday_quote.jpg,What counts can’t always be counted; what can be counted doesn’t always count. #<Author:0x00007fcdfaf71550>,
https://www.passiton.com/inspirational-quotes/7304-the-two-most-important-days-in-your-life-are,https://www.passiton.com/quotes/images/7304/large_20251114_friday_quote.jpg,The two most important days in your life are the day you are born and the day you find out why. #<Author:0x00007fcdfbc4ed90>,
https://www.passiton.com/inspirational-quotes/6999-its-not-so-much-how-busy-you-are-but-why-you,https://www.passiton.com/quotes/images/6999/large_20251113_thursday_quote.jpg,"It's not so much how busy you are, but why you are busy. #<Author:0x00007fcdfbc4e250>",
https://www.passiton.com/inspirational-quotes/7472-the-meaning-of-life-is-to-find-your-gift-the,https://www.passiton.com/quotes/images/7472/large_20251112_wednesday_quote.jpg,The meaning of life is to find your gift. The purpose of life is to give it away. #<Author:0x00007fcdfbc4d850>,
